{
  "record_id": "d00-dryrun-ci-native-001",
  "case_id": "d00-dryrun-ci-001",
  "protocol_version": "d00-comparator/v1",
  "domain": "ci",
  "arm": "native",
  "source_kind": "synthetic_dry_run",
  "task_semantics_ref": "experiments/d00/comparator-plan.md#ci-rerun-task-d01",
  "safety_standard_ref": "experiments/d00/comparator-plan.md#2-common-safety-and-outcome-standard",
  "authority_scope_ref": "owner-controlled-github-native-rerun-only",
  "account_ref": "synthetic-owner-account",
  "repository": "achirothmane/example-ci-dry-run",
  "workflow_ref": "synthetic-ci.yml",
  "run_id": "1001",
  "head_sha": "0123456789abcdef0123456789abcdef01234567",
  "run_attempt": 1,
  "started_at": "2026-09-30T04:00:00Z",
  "ended_at": "2026-09-30T04:02:00Z",
  "elapsed_seconds": 120,
  "active_seconds": 45,
  "waiting_seconds": 75,
  "provider_latency_seconds": 60,
  "installation_active_seconds": 10,
  "maintenance_active_seconds": 0,
  "exception_active_seconds": 5,
  "recovery_active_seconds": 0,
  "touches": 4,
  "outcome": "completed",
  "closure_disposition": "SYNTHETIC_DRY_RUN_COMPLETE",
  "included": true,
  "exclusion_reason": "",
  "sequence_position": 1,
  "crossover_group": "dryrun-ci-001",
  "order_constraint": "synthetic dry run; no causal comparison",
  "secret_scan": "pass",
  "redaction_version": "d00-redaction/v1",
  "notes_code": "SYNTHETIC_ONLY_NOT_BASELINE"
}
